{
  "$schema": "https://json-schema.org/draft/2020-12/schema",
  "$id": "urn:excellore:event:access.authz.changed.v1",
  "title": "access.authz.changed.v1",
  "type": "object",
  "required": [
    "specversion",
    "id",
    "type",
    "source",
    "time",
    "tenantid",
    "correlationid",
    "actor",
    "data"
  ],
  "properties": {
    "specversion": { "const": "1.0" },
    "id": { "type": "string", "format": "uuid" },
    "type": { "const": "access.authz.changed.v1" },
    "source": { "const": "excellore/access" },
    "time": { "type": "string", "format": "date-time" },
    "tenantid": { "type": "string", "format": "uuid" },
    "subject": { "type": "string" },
    "correlationid": { "type": "string", "format": "uuid" },
    "actor": {
      "type": "object",
      "required": ["sub", "type"],
      "properties": {
        "sub": { "type": "string", "minLength": 1 },
        "type": { "enum": ["human", "machine"] }
      },
      "additionalProperties": true
    },
    "data": {
      "type": "object",
      "required": ["tenantId", "authzVersion"],
      "properties": {
        "tenantId": { "type": "string", "format": "uuid" },
        "userIds": {
          "type": ["array", "null"],
          "items": { "type": "string", "format": "uuid" },
          "uniqueItems": true
        },
        "authzVersion": { "type": "integer", "minimum": 1 }
      },
      "additionalProperties": true
    }
  },
  "additionalProperties": true
}
